Sheet: Holy Tuesday Updater
A1: No | B1: Year | C1: Holy Tuesday | D1: Diff Next Year | E1: Shift Day | F1: Total Diff | G1: Total Year | H1: Next Holy Tuesday
A2: 1 | B2: 2024 | C2: 2024-03-26 | D2: 21 | E2: -1 | F2: of:=[.D2]+[.E2] -> 20 | G2: 365 | H2: of:=[.C2]+[.G2]+[.D2]+[.E2] -> 2025-04-15
A3: 2 | B3: 2025 | C3: of:=[.H2] -> 2025-04-15 | D3: -14 | E3: -1 | F3: of:=[.D3]+[.E3] -> -15 | G3: 365 | H3: of:=[.C3]+[.G3]+[.D3]+[.E3] -> 2026-03-31
A4: 3 | B4: 2026 | C4: of:=[.H3] -> 2026-03-31 | D4: -7 | E4: -1 | F4: of:=[.D4]+[.E4] -> -8 | G4: 365 | H4: of:=[.C4]+[.G4]+[.D4]+[.E4] -> 2027-03-23
A5: 4 | B5: 2027 | C5: of:=[.H4] -> 2027-03-23 | D5: 21 | E5: -2 | F5: of:=[.D5]+[.E5] -> 19 | G5: 366 | H5: of:=[.C5]+[.G5]+[.D5]+[.E5] -> 2028-04-11
A6: 5 | B6: 2028 | C6: of:=[.H5] -> 2028-04-11 | D6: -14 | E6: -1 | F6: of:=[.D6]+[.E6] -> -15 | G6: 365 | H6: of:=[.C6]+[.G6]+[.D6]+[.E6] -> 2029-03-27
A7: 6 | B7: 2029 | C7: of:=[.H6] -> 2029-03-27 | D7: 21 | E7: -1 | F7: of:=[.D7]+[.E7] -> 20 | G7: 365 | H7: of:=[.C7]+[.G7]+[.D7]+[.E7] -> 2030-04-16
A8: 7 | B8: 2030 | C8: of:=[.H7] -> 2030-04-16 | D8: -7 | E8: -1 | F8: of:=[.D8]+[.E8] -> -8 | G8: 365 | H8: of:=[.C8]+[.G8]+[.D8]+[.E8] -> 2031-04-08
A9: 8 | B9: 2031 | C9: of:=[.H8] -> 2031-04-08 | D9: -14 | E9: -2 | F9: of:=[.D9]+[.E9] -> -16 | G9: 366 | H9: of:=[.C9]+[.G9]+[.D9]+[.E9] -> 2032-03-23
A10: 9 | B10: 2032 | C10: of:=[.H9] -> 2032-03-23 | D10: 21 | E10: -1 | F10: of:=[.D10]+[.E10] -> 20 | G10: 365 | H10: of:=[.C10]+[.G10]+[.D10]+[.E10] -> 2033-04-12
A11: 10 | B11: 2033 | C11: of:=[.H10] -> 2033-04-12 | D11: -7 | E11: -1 | F11: of:=[.D11]+[.E11] -> -8 | G11: 365 | H11: of:=[.C11]+[.G11]+[.D11]+[.E11] -> 2034-04-04
A12: 11 | B12: 2034 | C12: of:=[.H11] -> 2034-04-04 | D12: -14 | E12: -1 | F12: of:=[.D12]+[.E12] -> -15 | G12: 365 | H12: of:=[.C12]+[.G12]+[.D12]+[.E12] -> 2035-03-20
A13: 12 | B13: 2035 | C13: of:=[.H12] -> 2035-03-20 | D13: 21 | E13: -2 | F13: of:=[.D13]+[.E13] -> 19 | G13: 366 | H13: of:=[.C13]+[.G13]+[.D13]+[.E13] -> 2036-04-08
A14: 13 | B14: 2036 | C14: of:=[.H13] -> 2036-04-08 | D14: -7 | E14: -1 | F14: of:=[.D14]+[.E14] -> -8 | G14: 365 | H14: of:=[.C14]+[.G14]+[.D14]+[.E14] -> 2037-03-31
A15: 14 | B15: 2037 | C15: of:=[.H14] -> 2037-03-31 | D15: 21 | E15: -1 | F15: of:=[.D15]+[.E15] -> 20 | G15: 365 | H15: of:=[.C15]+[.G15]+[.D15]+[.E15] -> 2038-04-20
A16: 15 | B16: 2038 | C16: of:=[.H15] -> 2038-04-20 | D16: -14 | E16: -1 | F16: of:=[.D16]+[.E16] -> -15 | G16: 365 | H16: of:=[.C16]+[.G16]+[.D16]+[.E16] -> 2039-04-05
A17: 16 | B17: 2039 | C17: of:=[.H16] -> 2039-04-05 | D17: -7 | E17: -2 | F17: of:=[.D17]+[.E17] -> -9 | G17: 366 | H17: of:=[.C17]+[.G17]+[.D17]+[.E17] -> 2040-03-27
A18: 17 | B18: 2040 | C18: of:=[.H17] -> 2040-03-27 | D18: 21 | E18: -1 | F18: of:=[.D18]+[.E18] -> 20 | G18: 365 | H18: of:=[.C18]+[.G18]+[.D18]+[.E18] -> 2041-04-16
A19: 18 | B19: 2041 | C19: of:=[.H18] -> 2041-04-16 | D19: -14 | E19: -1 | F19: of:=[.D19]+[.E19] -> -15 | G19: 365 | H19: of:=[.C19]+[.G19]+[.D19]+[.E19] -> 2042-04-01
A20: 19 | B20: 2042 | C20: of:=[.H19] -> 2042-04-01 | D20: -7 | E20: -1 | F20: of:=[.D20]+[.E20] -> -8 | G20: 365 | H20: of:=[.C20]+[.G20]+[.D20]+[.E20] -> 2043-03-24
A21: 20 | B21: 2043 | C21: of:=[.H20] -> 2043-03-24 | D21: 21 | E21: -2 | F21: of:=[.D21]+[.E21] -> 19 | G21: 366 | H21: of:=[.C21]+[.G21]+[.D21]+[.E21] -> 2044-04-12
A22: 21 | B22: 2044 | C22: of:=[.H21] -> 2044-04-12 | D22: -7 | E22: -1 | F22: of:=[.D22]+[.E22] -> -8 | G22: 365 | H22: of:=[.C22]+[.G22]+[.D22]+[.E22] -> 2045-04-04
A23: 22 | B23: 2045 | C23: of:=[.H22] -> 2045-04-04 | D23: -14 | E23: -1 | F23: of:=[.D23]+[.E23] -> -15 | G23: 365 | H23: of:=[.C23]+[.G23]+[.D23]+[.E23] -> 2046-03-20
A24: 23 | B24: 2046 | C24: of:=[.H23] -> 2046-03-20 | D24: 21 | E24: -1 | F24: of:=[.D24]+[.E24] -> 20 | G24: 365 | H24: of:=[.C24]+[.G24]+[.D24]+[.E24] -> 2047-04-09
A25: 24 | B25: 2047 | C25: of:=[.H24] -> 2047-04-09 | D25: -7 | E25: -2 | F25: of:=[.D25]+[.E25] -> -9 | G25: 366 | H25: of:=[.C25]+[.G25]+[.D25]+[.E25] -> 2048-03-31
A26: 25 | B26: 2048 | C26: of:=[.H25] -> 2048-03-31 | D26: 14 | E26: -1 | F26: of:=[.D26]+[.E26] -> 13 | G26: 365 | H26: of:=[.C26]+[.G26]+[.D26]+[.E26] -> 2049-04-13
A27: 26 | B27: 2049 | C27: of:=[.H26] -> 2049-04-13 | D27: -7 | E27: -1 | F27: of:=[.D27]+[.E27] -> -8 | G27: 365 | H27: of:=[.C27]+[.G27]+[.D27]+[.E27] -> 2050-04-05
A28: 27 | B28: 2050 | C28: of:=[.H27] -> 2050-04-05 | D28: -7 | E28: -1 | F28: of:=[.D28]+[.E28] -> -8 | G28: 365 | H28: of:=[.C28]+[.G28]+[.D28]+[.E28] -> 2051-03-28
A29: 28 | B29: 2051 | C29: of:=[.H28] -> 2051-03-28 | D29: 21 | E29: -2 | F29: of:=[.D29]+[.E29] -> 19 | G29: 366 | H29: of:=[.C29]+[.G29]+[.D29]+[.E29] -> 2052-04-16
A30: 29 | B30: 2052 | C30: of:=[.H29] -> 2052-04-16 | D30: -14 | E30: -1 | F30: of:=[.D30]+[.E30] -> -15 | G30: 365 | H30: of:=[.C30]+[.G30]+[.D30]+[.E30] -> 2053-04-01
A31: 30 | B31: 2053 | C31: of:=[.H30] -> 2053-04-01 | D31: -7 | E31: -1 | F31: of:=[.D31]+[.E31] -> -8 | G31: 365 | H31: of:=[.C31]+[.G31]+[.D31]+[.E31] -> 2054-03-24
A32: 31 | B32: 2054 | C32: of:=[.H31] -> 2054-03-24 | D32: 21 | E32: -1 | F32: of:=[.D32]+[.E32] -> 20 | G32: 365 | H32: of:=[.C32]+[.G32]+[.D32]+[.E32] -> 2055-04-13
A33: 32 | B33: 2055 | C33: of:=[.H32] -> 2055-04-13 | D33: -14 | E33: -2 | F33: of:=[.D33]+[.E33] -> -16 | G33: 366 | H33: of:=[.C33]+[.G33]+[.D33]+[.E33] -> 2056-03-28
A34: 33 | B34: 2056 | C34: of:=[.H33] -> 2056-03-28 | D34: 21 | E34: -1 | F34: of:=[.D34]+[.E34] -> 20 | G34: 365 | H34: of:=[.C34]+[.G34]+[.D34]+[.E34] -> 2057-04-17
A35: 34 | B35: 2057 | C35: of:=[.H34] -> 2057-04-17 | D35: -7 | E35: -1 | F35: of:=[.D35]+[.E35] -> -8 | G35: 365 | H35: of:=[.C35]+[.G35]+[.D35]+[.E35] -> 2058-04-09
A36: 35 | B36: 2058 | C36: of:=[.H35] -> 2058-04-09 | D36: -14 | E36: -1 | F36: of:=[.D36]+[.E36] -> -15 | G36: 365 | H36: of:=[.C36]+[.G36]+[.D36]+[.E36] -> 2059-03-25
A37: 36 | B37: 2059 | C37: of:=[.H36] -> 2059-03-25 | D37: 21 | E37: -2 | F37: of:=[.D37]+[.E37] -> 19 | G37: 366 | H37: of:=[.C37]+[.G37]+[.D37]+[.E37] -> 2060-04-13
A38: 37 | B38: 2060 | C38: of:=[.H37] -> 2060-04-13 | D38: -7 | E38: -1 | F38: of:=[.D38]+[.E38] -> -8 | G38: 365 | H38: of:=[.C38]+[.G38]+[.D38]+[.E38] -> 2061-04-05
A39: 38 | B39: 2061 | C39: of:=[.H38] -> 2061-04-05 | D39: -7 | E39: -1 | F39: of:=[.D39]+[.E39] -> -8 | G39: 365 | H39: of:=[.C39]+[.G39]+[.D39]+[.E39] -> 2062-03-28
A40: 39 | B40: 2062 | C40: of:=[.H39] -> 2062-03-28 | D40: 21 | E40: -1 | F40: of:=[.D40]+[.E40] -> 20 | G40: 365 | H40: of:=[.C40]+[.G40]+[.D40]+[.E40] -> 2063-04-17
A41: 40 | B41: 2063 | C41: of:=[.H40] -> 2063-04-17 | D41: -14 | E41: -2 | F41: of:=[.D41]+[.E41] -> -16 | G41: 366 | H41: of:=[.C41]+[.G41]+[.D41]+[.E41] -> 2064-04-01
A42: 41 | B42: 2064 | C42: of:=[.H41] -> 2064-04-01 | D42: -7 | E42: -1 | F42: of:=[.D42]+[.E42] -> -8 | G42: 365 | H42: of:=[.C42]+[.G42]+[.D42]+[.E42] -> 2065-03-24
A43: 42 | B43: 2065 | C43: of:=[.H42] -> 2065-03-24 | D43: 14 | E43: -1 | F43: of:=[.D43]+[.E43] -> 13 | G43: 365 | H43: of:=[.C43]+[.G43]+[.D43]+[.E43] -> 2066-04-06
A44: 43 | B44: 2066 | C44: of:=[.H43] -> 2066-04-06 | D44: -7 | E44: -1 | F44: of:=[.D44]+[.E44] -> -8 | G44: 365 | H44: of:=[.C44]+[.G44]+[.D44]+[.E44] -> 2067-03-29
A45: 44 | B45: 2067 | C45: of:=[.H44] -> 2067-03-29 | D45: 21 | E45: -2 | F45: of:=[.D45]+[.E45] -> 19 | G45: 366 | H45: of:=[.C45]+[.G45]+[.D45]+[.E45] -> 2068-04-17
A46: 45 | B46: 2068 | C46: of:=[.H45] -> 2068-04-17 | D46: -7 | E46: -1 | F46: of:=[.D46]+[.E46] -> -8 | G46: 365 | H46: of:=[.C46]+[.G46]+[.D46]+[.E46] -> 2069-04-09
A47: 46 | B47: 2069 | C47: of:=[.H46] -> 2069-04-09 | D47: -14 | E47: -1 | F47: of:=[.D47]+[.E47] -> -15 | G47: 365 | H47: of:=[.C47]+[.G47]+[.D47]+[.E47] -> 2070-03-25
A48: 47 | B48: 2070 | C48: of:=[.H47] -> 2070-03-25 | D48: 21 | E48: -1 | F48: of:=[.D48]+[.E48] -> 20 | G48: 365 | H48: of:=[.C48]+[.G48]+[.D48]+[.E48] -> 2071-04-14
A49: 48 | B49: 2071 | C49: of:=[.H48] -> 2071-04-14 | D49: -7 | E49: -2 | F49: of:=[.D49]+[.E49] -> -9 | G49: 366 | H49: of:=[.C49]+[.G49]+[.D49]+[.E49] -> 2072-04-05
A50: 49 | B50: 2072 | C50: of:=[.H49] -> 2072-04-05 | D50: -14 | E50: -1 | F50: of:=[.D50]+[.E50] -> -15 | G50: 365 | H50: of:=[.C50]+[.G50]+[.D50]+[.E50] -> 2073-03-21
A51: 50 | B51: 2073 | C51: of:=[.H50] -> 2073-03-21 | D51: 21 | E51: -1 | F51: of:=[.D51]+[.E51] -> 20 | G51: 365 | H51: of:=[.C51]+[.G51]+[.D51]+[.E51] -> 2074-04-10
A52: 51 | B52: 2074 | C52: of:=[.H51] -> 2074-04-10 | D52: -7 | E52: -1 | F52: of:=[.D52]+[.E52] -> -8 | G52: 365 | H52: of:=[.C52]+[.G52]+[.D52]+[.E52] -> 2075-04-02
A53: 52 | B53: 2075 | C53: of:=[.H52] -> 2075-04-02 | D53: 14 | E53: -2 | F53: of:=[.D53]+[.E53] -> 12 | G53: 366 | H53: of:=[.C53]+[.G53]+[.D53]+[.E53] -> 2076-04-14
A54: 53 | B54: 2076 | C54: of:=[.H53] -> 2076-04-14 | D54: -7 | E54: -1 | F54: of:=[.D54]+[.E54] -> -8 | G54: 365 | H54: of:=[.C54]+[.G54]+[.D54]+[.E54] -> 2077-04-06
A55: 54 | B55: 2077 | C55: of:=[.H54] -> 2077-04-06 | D55: -7 | E55: -1 | F55: of:=[.D55]+[.E55] -> -8 | G55: 365 | H55: of:=[.C55]+[.G55]+[.D55]+[.E55] -> 2078-03-29
A56: 55 | B56: 2078 | C56: of:=[.H55] -> 2078-03-29 | D56: 21 | E56: -1 | F56: of:=[.D56]+[.E56] -> 20 | G56: 365 | H56: of:=[.C56]+[.G56]+[.D56]+[.E56] -> 2079-04-18
A57: 56 | B57: 2079 | C57: of:=[.H56] -> 2079-04-18 | D57: -14 | E57: -2 | F57: of:=[.D57]+[.E57] -> -16 | G57: 366 | H57: of:=[.C57]+[.G57]+[.D57]+[.E57] -> 2080-04-02
A58: 57 | B58: 2080 | C58: of:=[.H57] -> 2080-04-02 | D58: -7 | E58: -1 | F58: of:=[.D58]+[.E58] -> -8 | G58: 365 | H58: of:=[.C58]+[.G58]+[.D58]+[.E58] -> 2081-03-25
A59: 58 | B59: 2081 | C59: of:=[.H58] -> 2081-03-25 | D59: 21 | E59: -1 | F59: of:=[.D59]+[.E59] -> 20 | G59: 365 | H59: of:=[.C59]+[.G59]+[.D59]+[.E59] -> 2082-04-14
A60: 59 | B60: 2082 | C60: of:=[.H59] -> 2082-04-14 | D60: -14 | E60: -1 | F60: of:=[.D60]+[.E60] -> -15 | G60: 365 | H60: of:=[.C60]+[.G60]+[.D60]+[.E60] -> 2083-03-30
A61: 60 | B61: 2083 | C61: of:=[.H60] -> 2083-03-30 | D61: 21 | E61: -2 | F61: of:=[.D61]+[.E61] -> 19 | G61: 366 | H61: of:=[.C61]+[.G61]+[.D61]+[.E61] -> 2084-04-18
A62: 61 | B62: 2084 | C62: of:=[.H61] -> 2084-04-18 | D62: -7 | E62: -1 | F62: of:=[.D62]+[.E62] -> -8 | G62: 365 | H62: of:=[.C62]+[.G62]+[.D62]+[.E62] -> 2085-04-10
A63: 62 | B63: 2085 | C63: of:=[.H62] -> 2085-04-10 | D63: -14 | E63: -1 | F63: of:=[.D63]+[.E63] -> -15 | G63: 365 | H63: of:=[.C63]+[.G63]+[.D63]+[.E63] -> 2086-03-26
A64: 63 | B64: 2086 | C64: of:=[.H63] -> 2086-03-26 | D64: 21 | E64: -1 | F64: of:=[.D64]+[.E64] -> 20 | G64: 365 | H64: of:=[.C64]+[.G64]+[.D64]+[.E64] -> 2087-04-15
A65: 64 | B65: 2087 | C65: of:=[.H64] -> 2087-04-15 | D65: -7 | E65: -2 | F65: of:=[.D65]+[.E65] -> -9 | G65: 366 | H65: of:=[.C65]+[.G65]+[.D65]+[.E65] -> 2088-04-06
A66: 65 | B66: 2088 | C66: of:=[.H65] -> 2088-04-06 | D66: -7 | E66: -1 | F66: of:=[.D66]+[.E66] -> -8 | G66: 365 | H66: of:=[.C66]+[.G66]+[.D66]+[.E66] -> 2089-03-29
A67: 66 | B67: 2089 | C67: of:=[.H66] -> 2089-03-29 | D67: 21 | E67: -1 | F67: of:=[.D67]+[.E67] -> 20 | G67: 365 | H67: of:=[.C67]+[.G67]+[.D67]+[.E67] -> 2090-04-18
A68: 67 | B68: 2090 | C68: of:=[.H67] -> 2090-04-18 | D68: -14 | E68: -1 | F68: of:=[.D68]+[.E68] -> -15 | G68: 365 | H68: of:=[.C68]+[.G68]+[.D68]+[.E68] -> 2091-04-03
A69: 68 | B69: 2091 | C69: of:=[.H68] -> 2091-04-03 | D69: -7 | E69: -2 | F69: of:=[.D69]+[.E69] -> -9 | G69: 366 | H69: of:=[.C69]+[.G69]+[.D69]+[.E69] -> 2092-03-25
A70: 69 | B70: 2092 | C70: of:=[.H69] -> 2092-03-25 | D70: 14 | E70: -1 | F70: of:=[.D70]+[.E70] -> 13 | G70: 365 | H70: of:=[.C70]+[.G70]+[.D70]+[.E70] -> 2093-04-07
A71: 70 | B71: 2093 | C71: of:=[.H70] -> 2093-04-07 | D71: -7 | E71: -1 | F71: of:=[.D71]+[.E71] -> -8 | G71: 365 | H71: of:=[.C71]+[.G71]+[.D71]+[.E71] -> 2094-03-30
A72: 71 | B72: 2094 | C72: of:=[.H71] -> 2094-03-30 | D72: 21 | E72: -1 | F72: of:=[.D72]+[.E72] -> 20 | G72: 365 | H72: of:=[.C72]+[.G72]+[.D72]+[.E72] -> 2095-04-19
A73: 72 | B73: 2095 | C73: of:=[.H72] -> 2095-04-19 | D73: -7 | E73: -2 | F73: of:=[.D73]+[.E73] -> -9 | G73: 366 | H73: of:=[.C73]+[.G73]+[.D73]+[.E73] -> 2096-04-10
A74: 73 | B74: 2096 | C74: of:=[.H73] -> 2096-04-10 | D74: -14 | E74: -1 | F74: of:=[.D74]+[.E74] -> -15 | G74: 365 | H74: of:=[.C74]+[.G74]+[.D74]+[.E74] -> 2097-03-26
A75: 74 | B75: 2097 | C75: of:=[.H74] -> 2097-03-26 | D75: 21 | E75: -1 | F75: of:=[.D75]+[.E75] -> 20 | G75: 365 | H75: of:=[.C75]+[.G75]+[.D75]+[.E75] -> 2098-04-15
A76: 75 | B76: 2098 | C76: of:=[.H75] -> 2098-04-15 | D76: -7 | E76: -1 | F76: of:=[.D76]+[.E76] -> -8 | G76: 365 | H76: of:=[.C76]+[.G76]+[.D76]+[.E76] -> 2099-04-07
A77: 76 | B77: 2099 | C77: of:=[.H76] -> 2099-04-07 | D77: -14 | E77: -1 | F77: of:=[.D77]+[.E77] -> -15 | G77: 365 | H77: of:=[.C77]+[.G77]+[.D77]+[.E77] -> 2100-03-23